{"authorization_id":"OWNER_APPROVED_B1V3_WRITTEN_SPEC_2026-08-14","blocking_reasons":[],"contract_selection_rule_id":"massive-contract-grid-v1-asof-dte-moneyness-tiebreak","network_attempt_count":6,"outcome_read_count":0,"pit_semantics_confirmed":false,"plan_sha256":"7b76d9004394e1a3c55f812b42adac7ab94eeb94dabb9f976536f0b1900b9a7c","provider_counts":{"fmp":{"expected":1,"passed":1},"massive":{"expected":1,"passed":1},"unusual_whales":{"expected":1,"passed":1}},"records":{"fmp":[{"asset":"AAPL","evidence_key":"fmp/2024-12-10/AAPL.json","exact_session_row_count":390,"network_attempts":1,"pass":true,"pit_claim":false,"provider":"fmp","provider_over_return_count":0,"reason":null,"request_fingerprint":"e2526bb1ee9b01397658a2215461d078c04aa64a2d5d14cb4268f6690a5f97fb","response_sha256":"44dbef84a5a3dd32503a859eb4f1b6545f3ec09d5fe4922b54b76c985155f8cd","returned_row_count":390,"session_date":"2024-12-10","spot":247.18,"status":"PASS_EXACT_SESSION_AVAILABILITY"}],"massive":[{"asset":"AAPL","contract_id":"O:AAPL250124C00245000","dte":45,"evidence_keys":["massive/2024-12-10/AAPL/search_medium_atm_v3_1.json","massive/2024-12-10/AAPL/search_medium_atm_v3_2.json","massive/2024-12-10/AAPL/reference_asof_v2.json","massive/2024-12-10/AAPL/quote.json"],"expiry":"2025-01-24","network_attempts":4,"pass":true,"pit_receipt_claim":false,"primary_filter_pass":true,"provider":"massive","quote_age_seconds":1.98649088,"reason":null,"relative_spread":0.024539877300613407,"request_fingerprints":["827c04729f8700d8b1a8c4efcef4dfacec49a832856d29ad70635808a359d453","297dbf2facf89e202ebedd2debb05e2e53ecd31f688a27bf1cecdde210f8b869","c5fc22717164a5257ba1c57b7e6012a1c4216fc860152c09fce6b3382336b29d","5f1383609d0817b2823b82ab0917ce6ebb2ace66d44ed977cd52ecfdbe151677"],"response_sha256":["67f8455f8a47828a1fb400fad2496247f69f3497b9e6b6388b3cf8e221891e57","9bbad47d8a252b3c992a1634a1f9f60b8104e1e1d713e3501cc6c6322822e30c","6c15a494cb91b73e7a9a30dac8683ffd7ba07860b73a8abb0adc7a680cb57dbd","9a2c5585a80152a61d294530a61f3c5926c75c0290f58d6ae651c9264347fc20"],"sensitivity_filter_pass":true,"session_date":"2024-12-10","sip_timestamp_ns":1733852698013509120,"status":"PASS_QUOTE_ASOF_SOURCE_TIME","target_moneyness":1.0}],"unusual_whales":[{"asset":null,"content_length_bytes":900916435,"evidence_key":"unusual_whales/2024-12-10/full_tape_metadata.json","full_tape_downloaded":false,"network_attempts":1,"pass":true,"pit_claim":false,"provider":"unusual_whales","reason":null,"request_fingerprint":"3faa20e155ab44983b6197deca850143cef73ce50f918f1b43f16eed7600442c","request_id":null,"response_sha256":"56a4e8eadee3e4b94ee5afcc9c71b042c46539f7c0681e36155bfc9c42268d18","session_date":"2024-12-10","status":"PASS_TRANSPORT_METADATA_ONLY"}]},"report_sha256":"9b26d1f1c7bd8d0c91899234a200c2c94c08880be78783fa27393d18ebd3ef8b","request_budget":{"asset_count":1,"fmp_requests":1,"http_attempt_cap":7,"massive_initial_search_requests":1,"massive_quote_requests":1,"massive_reference_requests":1,"massive_search_request_cap":3,"session_count":1,"uw_requests":1},"safe_to_acquire_predictors":true,"safe_to_read_outcomes":false,"schema_version":"b1v3-provider-preflight-report-2.0","security":{"credentialed_urls_emitted":false,"personal_paths_emitted":false,"secret_values_emitted":false,"uw_zip_body_downloaded":false},"status":"PASS_PROVIDER_PREFLIGHT_ASSUMPTION_BOUND","storage_gate":{"minimum_free_bytes":85899345920,"observed_free_bytes":337529405440,"status":"PASS"},"target_blind":true,"timing_boundary":{"fmp":"PLUS_1_MINUTE_RESEARCH_ASSUMPTION_PLUS_2_SENSITIVITY","massive":"SIP_SOURCE_TIME_ASOF_NOT_REST_RECEIPT_TIME","unusual_whales":"CREATED_AT_OPERATIONAL_PROXY_NOT_PUBLICATION_TIME"}}
